[
    {
        "cgdb_id": 603,
        "code": "attack_on_madripoor_by_merlin",
        "creator": "Merlin",
        "date_release": "2025-03-10",
        "name": "Madripoor's Dragon",
        "octgn_id": "3de3869c-3b99-58d1-b7bc-198e3f414e84",
        "pack_type_code": "scenar_fanmade",
        "position": 603,
        "size": 25,
        "status": "released"
    },
    {
        "cgdb_id": 604,
        "code": "rom_by_alias_&_merlin",
        "creator": "Alias & Merlin",
        "date_release": "2024-12-31",
        "name": "Rom",
        "octgn_id": "c89b0fd0-7794-55b7-8314-a57faf4202e6",
        "pack_type_code": "hero_fanmade",
        "position": 604,
        "size": 26,
        "status": "released",
        "theme": "Hasbro"
    },
    {
        "cgdb_id": 605,
        "code": "weapon_hex_by_merlin",
        "creator": "Merlin",
        "date_release": "2024-12-31",
        "name": "Weapon Hex",
        "octgn_id": "a609960e-607c-5889-921f-5e725e65ce5b",
        "pack_type_code": "hero_fanmade",
        "position": 605,
        "size": 23,
        "status": "released",
        "theme": "Marvel"
    },
    {
        "cgdb_id": 606,
        "code": "iron_fist_by_merlin",
        "creator": "Merlin",
        "date_release": "2024-12-31",
        "name": "Iron Fist",
        "octgn_id": "4cae2254-7233-5851-a397-e5f8f098edd7",
        "pack_type_code": "hero_fanmade",
        "position": 606,
        "size": 22,
        "status": "released",
        "theme": "Marvel",
        "visibility": "true"
    },
    {
        "cgdb_id": 703,
        "code": "mystique_by_merlin",
        "creator": "Merlin",
        "date_release": "2025-03-06",
        "name": "Mystique",
        "octgn_id": "15bee02e-f628-5492-9f96-3be16dd0aa3a",
        "pack_type_code": "hero_fanmade",
        "position": 703,
        "size": 26,
        "status": "released"
    },
    {
        "cgdb_id": 704,
        "code": "destiny_by_merlin",
        "creator": "Merlin",
        "date_release": "2025-03-06",
        "name": "Destiny",
        "octgn_id": "c9f54c39-12b4-5377-ace0-55551b1f825a",
        "pack_type_code": "hero_fanmade",
        "position": 704,
        "size": 23,
        "status": "released"
    },
    {
        "cgdb_id": 705,
        "code": "iron_man_noir_by_merlin",
        "creator": "Merlin",
        "date_release": "2024-12-31",
        "name": "Iron Man Noir",
        "octgn_id": "07741c02-2afb-5d7c-8088-7da43783c0c3",
        "pack_type_code": "hero_fanmade",
        "position": 705,
        "size": 27,
        "status": "released"
    },
    {
        "cgdb_id": 706,
        "code": "joe_fixit_by_merlin",
        "creator": "Merlin",
        "date_release": "2024-12-31",
        "name": "Joe Fixit",
        "octgn_id": "255a9090-1868-5a70-a084-7e646dc54737",
        "pack_type_code": "hero_fanmade",
        "position": 706,
        "size": 22,
        "status": "beta"
    },
    {
        "cgdb_id": 707,
        "code": "superior_iron_man_by_merlin",
        "creator": "Merlin",
        "date_release": "2024-12-31",
        "date_update": "2026-07-22",
        "name": "Superior Iron Man",
        "octgn_id": "eb348cf3-57f3-52ef-acc9-fab07a470154",
        "pack_type_code": "hero_fanmade",
        "position": 707,
        "size": 23,
        "status": "released"
    },
    {
        "cgdb_id": 708,
        "code": "red_hulk_by_merlin",
        "creator": "Merlin",
        "date_release": "2024-12-31",
        "date_update": "2026-07-23",
        "name": "Red Hulk",
        "octgn_id": "b1c7df6c-7f34-5ff7-bf32-9c58db219efd",
        "pack_type_code": "hero_fanmade",
        "position": 708,
        "size": 25,
        "status": "beta",
        "visibility": "true"
    },
    {
        "cgdb_id": 709,
        "code": "ghost_panther_by_merlin",
        "creator": "Merlin",
        "date_release": "2024-12-31",
        "name": "Ghost Panther",
        "octgn_id": "c987fcbc-c4d3-51c2-a88f-db10fac8fe41",
        "pack_type_code": "hero_fanmade",
        "position": 709,
        "size": 23,
        "status": "beta",
        "theme": "Marvel",
        "visibility": "false"
    },
    {
        "cgdb_id": 1031,
        "code": "mk_by_hax",
        "creator": "Designhacker",
        "date_release": "2025-08-21",
        "name": "Moon Knight",
        "octgn_id": "fb5e24e2-4df6-4512-9638-fd350335fb3b",
        "pack_type_code": "hero_fanmade",
        "position": 1031,
        "size": 25,
        "status": "sealed",
        "theme": "Marvel",
        "visibility": "true"
    },
    {
        "cgdb_id": 2001,
        "code": "mantis_by_bluehg",
        "creator": "BlueHG",
        "date_release": "2025-08-20",
        "name": "Mantis",
        "octgn_id": "d2407046-eb8c-5483-99d6-c7f3b237af34",
        "pack_type_code": "hero_fanmade",
        "position": 2001,
        "size": 22,
        "status": "sealed",
        "theme": "Marvel",
        "visibility": "true"
    },
    {
        "cgdb_id": 2002,
        "code": "rescue_by_rainy",
        "creator": "Rainy",
        "date_release": "2025-08-20",
        "name": "Rescue",
        "octgn_id": "744249b2-f7f3-55df-8f1a-69a48606a411",
        "pack_type_code": "hero_fanmade",
        "position": 2002,
        "size": 22,
        "status": "sealed",
        "theme": "Marvel",
        "visibility": "true"
    },
    {
        "cgdb_id": 2003,
        "code": "spider-man_by_rainy",
        "creator": "Rainy",
        "date_release": "2025-08-20",
        "name": "Spider-Man 2099",
        "octgn_id": "188a98aa-e714-56cf-92f0-8ccdf523996d",
        "pack_type_code": "hero_fanmade",
        "position": 2003,
        "size": 22,
        "status": "sealed",
        "theme": "Marvel",
        "visibility": "true"
    },
    {
        "cgdb_id": 2004,
        "code": "polaris_by_jackhkp",
        "creator": "JackHKP",
        "date_release": "2025-08-23",
        "name": "Polaris",
        "octgn_id": "ab4e6448-4f17-5734-8f18-f41e30c00f09",
        "pack_type_code": "hero_fanmade",
        "position": 2004,
        "size": 24,
        "status": "sealed",
        "theme": "Marvel",
        "visibility": "true"
    },
    {
        "cgdb_id": 2005,
        "code": "wasp_by_jackhkp",
        "creator": "JackHKP",
        "date_release": "2025-08-01",
        "name": "Wasp",
        "octgn_id": "5fbe8550-ee38-5775-83b2-91ddfb1b4786",
        "pack_type_code": "hero_fanmade",
        "position": 2005,
        "size": 23,
        "status": "beta",
        "visibility": "false"
    },
    {
        "cgdb_id": 2006,
        "code": "heimdall_by_jackhkp",
        "creator": "JackHKP",
        "date_release": "2025-09-15",
        "name": "Heimdall",
        "octgn_id": "c9c9899a-e4d2-412f-9dd0-dd6f3b2108cf",
        "pack_type_code": "hero_fanmade",
        "position": 2006,
        "size": 23,
        "status": "released",
        "theme": "Marvel",
        "visibility": "true"
    },
    {
        "cgdb_id": 2010,
        "code": "blink_by_kajislav",
        "creator": "Kajislav",
        "date_release": "2025-09-21",
        "name": "Blink",
        "octgn_id": "381bd788-111a-5f4f-a3eb-bcb150fa67c5",
        "pack_type_code": "hero_fanmade",
        "position": 2010,
        "size": 22,
        "status": "released",
        "theme": "Marvel",
        "visibility": "true"
    },
    {
        "cgdb_id": 2011,
        "code": "ghost_rider_by_swept_&_jiub",
        "creator": "Swept & Jiub",
        "date_release": "2026-06-02",
        "name": "Ghost Rider",
        "octgn_id": "8a4a4ea7-f221-51fd-9475-1d693cfab27e",
        "pack_type_code": "hero_fanmade",
        "position": 2011,
        "size": 22,
        "status": "released",
        "theme": "Marvel",
        "visibility": "true"
    },
    {
        "cgdb_id": 2013,
        "code": "yondu_by_hax",
        "creator": "Designhacker & BlueHG",
        "date_release": "2025-08-24",
        "date_update": "2026-07-22",
        "name": "Yondu",
        "octgn_id": "8ed5030f-bb57-4682-aad0-fc5f5368cc77",
        "pack_type_code": "hero_fanmade",
        "position": 2013,
        "size": 22,
        "status": "released",
        "theme": "Marvel",
        "visibility": "true"
    },
    {
        "cgdb_id": 2014,
        "code": "ser_reddwyn_by_justatuna",
        "creator": "JustaTuna",
        "date_release": "2025-08-28",
        "name": "Ser Reddwyn",
        "octgn_id": "6db56efb-88fb-5b74-9dc8-c546b403121e",
        "pack_type_code": "hero_fanmade",
        "position": 2014,
        "size": 28,
        "status": "released",
        "theme": "Marvel",
        "visibility": "true"
    },
    {
        "cgdb_id": 2015,
        "code": "ms_marvel_by_cptscorp_&_rycoran",
        "creator": "CptScorp & RyCoRan",
        "date_release": "2025-11-04",
        "name": "Ms. Marvel",
        "octgn_id": "a4082154-3c42-520c-ade7-5ee1eca38441",
        "pack_type_code": "hero_fanmade",
        "position": 2015,
        "size": 22,
        "status": "released",
        "theme": "Marvel",
        "visibility": "true"
    },
    {
        "cgdb_id": 2017,
        "code": "manifold_by_bluehg",
        "creator": "BlueHG",
        "date_release": "2026-05-16",
        "name": "Manifold",
        "octgn_id": "0a6276d1-079f-4b56-83f6-da46aa177d8d",
        "pack_type_code": "hero_fanmade",
        "position": 2017,
        "size": 32,
        "status": "released",
        "theme": "Marvel",
        "visibility": "true"
    },
    {
        "cgdb_id": 2020,
        "code": "iron_man_by_raytten",
        "creator": "Raytten",
        "date_release": "2025-08-18",
        "name": "Iron Man mk LXX",
        "octgn_id": "81d41f69-1640-51c5-ace6-3177e599f78e",
        "pack_type_code": "hero_fanmade",
        "position": 2020,
        "size": 22,
        "status": "released",
        "theme": "Marvel"
    },
    {
        "cgdb_id": 2021,
        "code": "mighty_thor_by_rainy",
        "creator": "Rainy",
        "date_release": "2025-11-02",